{
  "anchor_id": "anchor-demo",
  "anchor_time_epoch_ms": 1800000000000,
  "trigger_observation_id": "obs-image-120",
  "current_asset_id": "asset-image-120",
  "candidate_object_handle": "obj_19a1",
  "candidate_episode_handle": "ep_8f0c",
  "trigger_families": ["TRANSITION_SETTLED", "DEADLINE_APPROACH", "VISUAL_NOVELTY"],
  "score": 0.75,
  "scheduler_diagnostics_private": {
    "motion_stable": true,
    "trigger_match": true
  }
}
